王荣,青海省天津市白云沈阳路L座 416758
黎静,安徽省澳门市黄浦贵阳路N座 150926
刘倩,浙江省丽市沈河昆明路D座 877960
黄波,内蒙古自治区帅市沈河谈路d座 429062
叶俊,青海省合肥市山亭济南路j座 407764
陈鹏,安徽省张家港县南溪关岭街C座 769806
张秀芳,辽宁省济南县大东关岭路y座 788533
胡雪梅,湖南省强市房山拉萨街o座 177214
李阳,内蒙古自治区石家庄县金平方路D座 846515
严小红,云南省石家庄县浔阳北镇街o座 913854
向亮,台湾省英县平山李路G座 939033
梁坤,新疆维吾尔自治区兰州县西夏张路z座 443689
陈海燕,云南省济南县永川崔路R座 447174
张玉兰,贵州省东莞市沙市王街s座 219854
高梅,澳门特别行政区平县萧山阜新街H座 869725
唐华,辽宁省柳州县滨城杨街y座 453966
佘帅,香港特别行政区济南县永川东莞路C座 187153
王桂珍,河南省惠州市淄川刘街O座 810985
蔡桂花,陕西省雪梅市华龙刘路U座 932559
吴亮,广东省南宁县黄浦张路f座 438867
蔡帅,陕西省璐县西峰李路I座 813143
陈兵,四川省哈尔滨县上街成路O座 895041
罗金凤,甘肃省嘉禾市吉区成都路R座 764626
李淑兰,江西省楠县海港福州街L座 141876
任瑞,山西省平县金平陈路i座 275496
